{
  "aidoc": "0.1",
  "provenance": {
    "generatedBy": "claude-code",
    "model": "claude-opus-5-5",
    "reviewed": false,
    "created": "2026-10-08"
  },
  "sections": {
    "overview": {
      "summary": "The Transformer, introduced in 2017 in \"Attention Is All You Need\", replaced the step-by-step processing of recurrent networks with attention, which lets every position look directly at every other position. Because these comparisons can run in parallel on GPUs, much larger models could be trained on much more data. Data flows through tokens, embeddings, positional encoding, attention with queries, keys and values, multi-head attention, feed-forward networks, residual connections and layer normalization, stacked Transformer blocks, and, during generation, the KV cache. Most modern text generators use only the decoder half of the original encoder-decoder design.",
      "simpleExplanation": "Older language models read a sentence one word at a time, like reading through a keyhole, so they were slow and forgot early words. A Transformer looks at all the words at once and lets each word decide which other words matter to it. Because it can do all of that at the same time, computers can train it quickly and make it very big. That is why almost every modern AI that writes text is a Transformer.",
      "keyPoints": [
        "The Transformer was introduced in 2017 in \"Attention Is All You Need\".",
        "It replaced recurrence with attention, so every position can look at every other position directly.",
        "Attention computations run in parallel, which made training much larger models practical.",
        "Most chat and text-generation models (GPT, Llama) are decoder-only and predict the next token.",
        "The original Transformer had an encoder and a decoder, designed for machine translation."
      ],
      "quiz": [
        {
          "id": "q-overview-1",
          "question": "What did the Transformer replace recurrence with?",
          "options": [
            "Convolution",
            "Decision trees",
            "Attention",
            "Word counting"
          ],
          "answerIndex": 2,
          "explanation": "The Transformer replaced the step-by-step recurrence of RNNs with attention, letting every position look directly at every other position."
        },
        {
          "id": "q-overview-2",
          "question": "Why could Transformers be trained at a much larger scale than RNNs?",
          "options": [
            "Their attention computations can run in parallel",
            "They use fewer parameters",
            "They don't need training data",
            "They only read the first word of each sentence"
          ],
          "answerIndex": 0,
          "explanation": "RNNs had to wait for each previous step. The comparisons in attention are independent, so they can all be computed at once on a GPU."
        },
        {
          "id": "q-overview-3",
          "question": "Which part of the original Transformer do most modern text-generation models use?",
          "options": [
            "Only the encoder",
            "Only the decoder",
            "Both encoder and decoder",
            "Neither; they use RNNs"
          ],
          "answerIndex": 1,
          "explanation": "Models like GPT and Llama are decoder-only: they predict the next token from all previous tokens."
        }
      ]
    },
    "tokens": {
      "summary": "Models work with numbers, so text is first split into tokens, each with an integer ID from a fixed vocabulary. Character-level tokens make sequences too long, and whole-word tokens need a huge vocabulary and fail on unseen words, so modern models use subword tokenization: common words are single tokens and rare words are built from pieces. The main algorithms are Byte-Pair Encoding (used by GPT), WordPiece (used by BERT, with ## continuation pieces) and Unigram/SentencePiece. Vocabulary size trades shorter sequences against larger embedding and output layers. Tokenization explains why models struggle with letter-level tasks; in English one token is roughly four characters.",
      "simpleExplanation": "Before a model can read text, it chops the text into small pieces called tokens and gives each piece a number. Common words like \"the\" are one piece. Long or unusual words are built from smaller pieces, like building a word out of LEGO bricks. This way the model never meets a word it can't handle. Because the model sees pieces and not letters, it can find it oddly hard to count the letters in a word.",
      "keyPoints": [
        "A tokenizer splits text into tokens and maps each to an integer ID in the vocabulary.",
        "Subword tokenization balances vocabulary size against sequence length and handles unseen words.",
        "Byte-Pair Encoding merges frequent pairs; WordPiece marks word continuations with ##; SentencePiece works on raw text including spaces.",
        "Bigger vocabularies mean shorter sequences but larger embedding and output matrices.",
        "Special tokens mark things like the start or end of a sequence and chat roles.",
        "In English, one token is about four characters, or three quarters of a word."
      ],
      "quiz": [
        {
          "id": "q-tokens-1",
          "question": "Why don't modern models use whole words as tokens?",
          "options": [
            "The vocabulary would be huge and unseen words would be unknown",
            "Words are too short",
            "Words cannot be turned into numbers",
            "GPUs cannot process words"
          ],
          "answerIndex": 0,
          "explanation": "Whole-word vocabularies need millions of entries and turn any unseen word into an unknown token. Subwords avoid both problems."
        },
        {
          "id": "q-tokens-2",
          "question": "Which tokenizer marks continuation pieces with a prefix like ##?",
          "options": [
            "WordPiece",
            "Byte-Pair Encoding",
            "Character-level",
            "Sinusoidal"
          ],
          "answerIndex": 0,
          "explanation": "WordPiece, used by BERT, writes pieces that continue a word with a ## prefix, for example \"play\" + \"##ing\"."
        },
        {
          "id": "q-tokens-3",
          "question": "What is a downside of a very large vocabulary?",
          "options": [
            "Sequences become longer",
            "The embedding table and output layer become larger",
            "The model cannot handle English",
            "Attention stops working"
          ],
          "answerIndex": 1,
          "explanation": "A larger vocabulary shortens sequences but needs more rows in the embedding table and the final output layer."
        },
        {
          "id": "q-tokens-4",
          "question": "Roughly how many characters is one English token?",
          "options": [
            "1",
            "4",
            "20",
            "100"
          ],
          "answerIndex": 1,
          "explanation": "As a rough rule, one English token is about four characters, or three quarters of a word."
        }
      ]
    },
    "embeddings": {
      "summary": "An embedding turns each token ID into a learned vector of d_model numbers by looking up a row in an embedding table with one row per vocabulary token. The values start random and are learned in training, so tokens used in similar contexts end up close together in a semantic space. d_model is the width of the residual stream: 512 in the original Transformer, 768 in GPT-2 small, and thousands in large models. Input embeddings are context-free; later layers turn them into contextual representations. At the output, a similar matrix produces logits over the vocabulary, often tied to the input embeddings.",
      "simpleExplanation": "An embedding is like giving every token a home address on a giant map with hundreds of directions instead of two. Words that are used in similar ways, like \"cat\" and \"dog\", end up living near each other. The model learns where to put each word while it trains. At first a word has the same address in every sentence; the layers after this step adjust it based on the surrounding words.",
      "keyPoints": [
        "The embedding layer is a lookup table with one row (vector) per vocabulary token.",
        "Embedding values are learned during training; similar tokens end up with similar vectors.",
        "d_model is the size of each token's vector throughout the model.",
        "Input embeddings ignore context; attention layers make them contextual.",
        "The output layer turns final vectors into logits, one per vocabulary token; it is often tied to the input embedding."
      ],
      "quiz": [
        {
          "id": "q-embeddings-1",
          "question": "What does the embedding layer do with a token ID?",
          "options": [
            "Runs it through attention",
            "Looks up the row of a learned table at that index",
            "Converts it to text",
            "Adds a sine wave to it"
          ],
          "answerIndex": 1,
          "explanation": "The embedding layer is a lookup table; embedding a token means reading the row whose index is the token ID."
        },
        {
          "id": "q-embeddings-2",
          "question": "How are embedding values chosen?",
          "options": [
            "Designed by hand by linguists",
            "Copied from a dictionary",
            "Learned during training",
            "Set to the token ID"
          ],
          "answerIndex": 2,
          "explanation": "They start random and are learned along with every other parameter."
        },
        {
          "id": "q-embeddings-3",
          "question": "Why is the input embedding of \"bank\" the same in \"river bank\" and \"bank loan\"?",
          "options": [
            "Because of a bug",
            "Because the lookup doesn't know the context",